[
  {
    "case_id": "borrow-lifetime",
    "category": "borrow-checker",
    "failure_mode": "move while borrowed",
    "expected_signal": "error[E0505]",
    "docs": ["https://doc.rust-lang.org/book/ch04-02-references-and-borrowing.html"],
    "fix_pattern": "Clone, reorder ownership transfer, or narrow the borrow scope.",
    "benchmarkable": true,
    "mode": "compile",
    "manifest_path": "labs/exception-zoo/cases/borrow-lifetime/Cargo.toml",
    "cargo_args": []
  },
  {
    "case_id": "feature-conflict",
    "category": "feature-graph",
    "failure_mode": "mutually exclusive features",
    "expected_signal": "legacy and strict cannot be enabled together",
    "docs": ["https://doc.rust-lang.org/cargo/reference/features.html"],
    "fix_pattern": "Split incompatible modes into crates or reject the combination with a targeted compile_error!.",
    "benchmarkable": true,
    "mode": "compile",
    "manifest_path": "labs/exception-zoo/cases/feature-conflict/Cargo.toml",
    "cargo_args": ["--features", "legacy,strict"]
  },
  {
    "case_id": "undocumented-unsafe",
    "category": "safety",
    "failure_mode": "unsafe without a safety comment",
    "expected_signal": "undocumented-unsafe",
    "docs": ["https://doc.rust-lang.org/book/ch20-01-unsafe-rust.html"],
    "fix_pattern": "Add a nearby SAFETY comment that explains the preconditions.",
    "benchmarkable": true,
    "mode": "scan",
    "manifest_path": "labs/exception-zoo/cases/undocumented-unsafe/Cargo.toml",
    "cargo_args": []
  },
  {
    "case_id": "semver-break",
    "category": "public-api-proof",
    "failure_mode": "public API crate lacks local doc proof",
    "expected_signal": "public-api-no-doctest-coverage",
    "docs": ["https://doc.rust-lang.org/cargo/commands/cargo-test.html"],
    "fix_pattern": "Add doctests and scheduled semver checks for the public crate.",
    "benchmarkable": true,
    "mode": "scan",
    "manifest_path": "labs/exception-zoo/cases/semver-break/Cargo.toml",
    "cargo_args": []
  },
  {
    "case_id": "hidden-io-core",
    "category": "hidden-side-effects",
    "failure_mode": "I/O inside a pure/core layer",
    "expected_signal": "hidden-side-effects",
    "docs": ["https://doc.rust-lang.org/book/ch13-04-performance.html"],
    "fix_pattern": "Move file or env access to the adapter edge and inject the value.",
    "benchmarkable": true,
    "mode": "scan",
    "manifest_path": "labs/exception-zoo/cases/hidden-io-core/Cargo.toml",
    "cargo_args": []
  },
  {
    "case_id": "async-panic",
    "category": "runtime",
    "failure_mode": "panic in async-adjacent test flow",
    "expected_signal": "vibe panic surfaced",
    "docs": ["https://doc.rust-lang.org/book/ch09-01-unrecoverable-errors-with-panic.html"],
    "fix_pattern": "Normalize the panic into a handled error path and assert the behavior explicitly.",
    "benchmarkable": true,
    "mode": "test",
    "manifest_path": "labs/exception-zoo/cases/async-panic/Cargo.toml",
    "cargo_args": []
  },
  {
    "case_id": "integration-test-forest",
    "category": "test-topology",
    "failure_mode": "many top-level integration test binaries",
    "expected_signal": "integration-test-forest",
    "docs": ["https://doc.rust-lang.org/cargo/reference/cargo-targets.html"],
    "fix_pattern": "Collapse related integration tests into fewer harnesses with modules.",
    "benchmarkable": true,
    "mode": "scan",
    "manifest_path": "labs/exception-zoo/cases/integration-test-forest/Cargo.toml",
    "cargo_args": []
  }
]
